{
  "case_id": "ca.dbr.short",
  "protocol": "ca",
  "byte_order": "big",
  "source": {
    "spec": "Channel Access Protocol Specification",
    "url": "https://docs.epics-controls.org/en/latest/internal/ca_protocol.html",
    "section": "DBR data types — DBR_SHORT/DBR_INT (dbr_short_t)",
    "note": "dbr_short_t is epicsInt16 (signed 16-bit). DBR_INT (code 1) is an exact alias of DBR_SHORT. Value 4660 = 0x1234. Layout per epics-base modules/ca/src/client/db_access.h. Hand-authored anchor, machine-verified against real EPICS in 0c-3."
  },
  "segments": {
    "value_bytes_hex": "12 34"
  },
  "decoded": {
    "schema_version": "0a",
    "type": { "kind": "scalar", "type": "int", "width": 16, "signed": true },
    "value": 4660
  }
}
