{
  "case_id": "ca.dbr_sts.char",
  "protocol": "ca",
  "byte_order": "big",
  "source": {
    "spec": "Channel Access Protocol Specification",
    "url": "https://docs.epics-controls.org/en/latest/internal/ca_protocol.html",
    "section": "DBR data types — DBR_STS_CHAR (struct dbr_sts_char)",
    "note": "Layout: status (i16), severity (i16), RISC_pad (dbr_char_t, 1 byte), value (dbr_char_t u8). The 1-byte RISC_pad is wire-only (a byte-identical degree of freedom), not a value-tree field. status=1, severity=2, pad=0x00, value=65=0x41. Per epics-base modules/ca/src/client/db_access.h. Hand-authored anchor, machine-verified against real EPICS in 0c-3."
  },
  "segments": {
    "value_bytes_hex": "00 01 00 02 00 41"
  },
  "decoded": {
    "schema_version": "0a",
    "type": {
      "kind": "struct",
      "fields": [
        { "name": "status", "type": { "kind": "scalar", "type": "int", "width": 16, "signed": true } },
        { "name": "severity", "type": { "kind": "scalar", "type": "int", "width": 16, "signed": true } },
        { "name": "value", "type": { "kind": "scalar", "type": "int", "width": 8, "signed": false } }
      ]
    },
    "value": { "status": 1, "severity": 2, "value": 65 }
  }
}
