{
  "case_id": "ca.dbr_sts.string",
  "protocol": "ca",
  "byte_order": "big",
  "source": {
    "spec": "Channel Access Protocol Specification",
    "url": "https://docs.epics-controls.org/en/latest/internal/ca_protocol.html",
    "section": "DBR data types — DBR_STS_STRING (struct dbr_sts_string)",
    "note": "Layout: status (dbr_short_t i16), severity (dbr_short_t i16), value (char[40] NUL-padded). No RISC_pad. status/severity are value-tree fields; trailing NUL padding of the string is a byte-identical degree of freedom. Per epics-base modules/ca/src/client/db_access.h. Hand-authored anchor, machine-verified against real EPICS in 0c-3."
  },
  "segments": {
    "value_bytes_hex": "00 01 00 02 48 65 6C 6C 6F 00 00 00 00 00 00 00 00 00 00 00 00 00 00 00 00 00 00 00 00 00 00 00 00 00 00 00 00 00 00 00 00 00 00 00"
  },
  "decoded": {
    "schema_version": "0a",
    "type": {
      "kind": "struct",
      "fields": [
        { "name": "status", "type": { "kind": "scalar", "type": "int", "width": 16, "signed": true } },
        { "name": "severity", "type": { "kind": "scalar", "type": "int", "width": 16, "signed": true } },
        { "name": "value", "type": { "kind": "scalar", "type": "string" } }
      ]
    },
    "value": { "status": 1, "severity": 2, "value": "Hello" }
  }
}
