{
  "case_id": "ca.dbr_sts.long",
  "protocol": "ca",
  "byte_order": "big",
  "source": {
    "spec": "Channel Access Protocol Specification",
    "url": "https://docs.epics-controls.org/en/latest/internal/ca_protocol.html",
    "section": "DBR data types — DBR_STS_LONG (struct dbr_sts_long)",
    "note": "Layout: status (i16), severity (i16), value (dbr_long_t i32). No RISC_pad. status=1, severity=2, value=305419896=0x12345678. Per epics-base modules/ca/src/client/db_access.h. Hand-authored anchor, machine-verified against real EPICS in 0c-3."
  },
  "segments": {
    "value_bytes_hex": "00 01 00 02 12 34 56 78"
  },
  "decoded": {
    "schema_version": "0a",
    "type": {
      "kind": "struct",
      "fields": [
        { "name": "status", "type": { "kind": "scalar", "type": "int", "width": 16, "signed": true } },
        { "name": "severity", "type": { "kind": "scalar", "type": "int", "width": 16, "signed": true } },
        { "name": "value", "type": { "kind": "scalar", "type": "int", "width": 32, "signed": true } }
      ]
    },
    "value": { "status": 1, "severity": 2, "value": 305419896 }
  }
}
