{
  "case_id": "pva.bitset.empty",
  "protocol": "pva",
  "byte_order": "little",
  "source": {
    "spec": "pvAccess Data Encoding",
    "url": "https://docs.epics-controls.org/en/latest/pv-access/Protocol-Encoding.html",
    "section": "BitSet encoding — empty set",
    "note": "Size 0 (no bytes follow). A BitSet is a Size byte count followed by little-endian bytes; bit i is bit (i mod 8) of byte (i div 8)."
  },
  "segments": { "meta_bytes_hex": "00" },
  "decoded": { "meta": { "kind": "bitset", "indices": [] } }
}
