{
  "case_id": "pva.bitset.bit1",
  "protocol": "pva",
  "byte_order": "little",
  "source": {
    "spec": "pvAccess Data Encoding",
    "url": "https://docs.epics-controls.org/en/latest/pv-access/Protocol-Encoding.html",
    "section": "BitSet encoding — { 1 }",
    "note": "Size 1, byte 0x02 = bit 1 set."
  },
  "segments": { "meta_bytes_hex": "01 02" },
  "decoded": { "meta": { "kind": "bitset", "indices": [1] } }
}
