{
  "case_id": "ca.dbr_time.enum",
  "protocol": "ca",
  "byte_order": "big",
  "source": {
    "spec": "Channel Access Protocol Specification",
    "url": "https://docs.epics-controls.org/en/latest/internal/ca_protocol.html",
    "section": "DBR data types — DBR_TIME_ENUM (struct dbr_time_enum)",
    "note": "Layout: status (i16), severity (i16), stamp ({secPastEpoch u32, nsec u32}), RISC_pad (dbr_short_t, 2 bytes), value (dbr_enum_t u16, raw index). The 2-byte RISC_pad is wire-only. EPICS epoch 1990-01-01. stamp = {0x3B9ACA00, 0x1DCD6500}, pad=0x0000, value=3. Per epics-base modules/ca/src/client/db_access.h. Hand-authored anchor, machine-verified against real EPICS in 0c-3."
  },
  "segments": {
    "value_bytes_hex": "00 01 00 02 3B 9A CA 00 1D CD 65 00 00 00 00 03"
  },
  "decoded": {
    "schema_version": "0a",
    "type": {
      "kind": "struct",
      "fields": [
        { "name": "status", "type": { "kind": "scalar", "type": "int", "width": 16, "signed": true } },
        { "name": "severity", "type": { "kind": "scalar", "type": "int", "width": 16, "signed": true } },
        { "name": "stamp", "type": { "kind": "struct", "fields": [
          { "name": "secPastEpoch", "type": { "kind": "scalar", "type": "int", "width": 32, "signed": false } },
          { "name": "nsec", "type": { "kind": "scalar", "type": "int", "width": 32, "signed": false } }
        ] } },
        { "name": "value", "type": { "kind": "scalar", "type": "int", "width": 16, "signed": false } }
      ]
    },
    "value": { "status": 1, "severity": 2, "stamp": { "secPastEpoch": 1000000000, "nsec": 500000000 }, "value": 3 }
  }
}
