{
  "case_id": "ca.dbr.float",
  "protocol": "ca",
  "byte_order": "big",
  "source": {
    "spec": "Channel Access Protocol Specification",
    "url": "https://docs.epics-controls.org/en/latest/internal/ca_protocol.html",
    "section": "DBR data types — DBR_FLOAT (dbr_float_t)",
    "note": "dbr_float_t is epicsFloat32 (IEEE-754 binary32). Value 1.5 = 0x3FC00000. Layout per epics-base modules/ca/src/client/db_access.h. Hand-authored anchor, machine-verified against real EPICS in 0c-3."
  },
  "segments": {
    "value_bytes_hex": "3F C0 00 00"
  },
  "decoded": {
    "schema_version": "0a",
    "type": { "kind": "scalar", "type": "float", "width": 32 },
    "value": 1.5
  }
}
