{
  "case_id": "ca.dbr_sts.double",
  "protocol": "ca",
  "byte_order": "big",
  "source": {
    "spec": "Channel Access Protocol Specification",
    "url": "https://docs.epics-controls.org/en/latest/internal/ca_protocol.html",
    "section": "DBR data types — DBR_STS_DOUBLE (struct dbr_sts_double)",
    "note": "Layout: status (i16), severity (i16), RISC_pad (dbr_long_t, 4 bytes), value (dbr_double_t f64). The 4-byte RISC_pad aligns the f64 to an 8-byte boundary and is wire-only (a byte-identical degree of freedom), not a value-tree field. status=1, severity=2, pad=0x00000000, value=1.5=0x3FF8000000000000. Per epics-base modules/ca/src/client/db_access.h. Hand-authored anchor, machine-verified against real EPICS in 0c-3."
  },
  "segments": {
    "value_bytes_hex": "00 01 00 02 00 00 00 00 3F F8 00 00 00 00 00 00"
  },
  "decoded": {
    "schema_version": "0a",
    "type": {
      "kind": "struct",
      "fields": [
        { "name": "status", "type": { "kind": "scalar", "type": "int", "width": 16, "signed": true } },
        { "name": "severity", "type": { "kind": "scalar", "type": "int", "width": 16, "signed": true } },
        { "name": "value", "type": { "kind": "scalar", "type": "float", "width": 64 } }
      ]
    },
    "value": { "status": 1, "severity": 2, "value": 1.5 }
  }
}
